sense_1,sense_2,main_cl
притягивать притянуть подтягивать подтянуть подтаскивать подтащить кого что к чему,плотно закрывать закрыть что,1781
отходить отойти от кого чего аблын адыц ра отойти от стены,шкар расходиться разойтись разводиться развестись о супругах в,2691
быть в хороших отношениях друг с другом,соответствовать подходить подойти друг другу,1376
провозглашать провозгласить здравицу в честь друг друга,поздравлять поздравить друг друга,3071
нравиться понравиться кому,сильно желать пожелать чего,872
нравиться понравиться кому,соблазняться соблазниться чем,2497
нравиться понравиться кому,сильное желание,1148
великан,циклоп,999
становиться стать упрямым заупрямиться,становиться стать упорным настойчивым,1215
завидовать кому чему,соблазняться соблазниться чем,2811
погибать погибнуть из за чего,терпеть потерпеть неудачу погореть на чём из за кого чего,3012
погибать погибнуть из за чего,терпеть потерпеть неудачу погореть на чём из за кого чего,3012
хлопать похлопать чему,стучать постучать во что по чему тихо слегка,2142
возвращаться вернуться к ранее начатому или сделанному,возвращаться вернуться за чем,2594
вписывать вписать что куда,писать написать что чем,1286
плести сплетать сплести что,соединять соединить напр концы верёвки проводов,2603
резать что нарезать нарезать что чего во что," резать (нарезать, рубить, нарубить) что, смешивая с чем (напр. помидоры с огурцами)",1807
резать что нарезать нарезать что чего во что," резать, нарезать, разрубать, разрубить что (на мелкие куски)",1759
увеличивать увеличить что,увеличение,1718
увеличивать увеличить что,увеличение,1718
заводить завести включать включить мотор и,завод включение мотора и,1580
разрушать разрушить что чем," разрушать, разрушить что",1942
разбиваться разбиться вдребезги,хрустеть издавать издать хруст треск,1901
выбирать выбрать избирать избрать кого,выбор отбор,1231
прерывать прервать перебивать перебить кого что,мешать помешать кому заниматься чем л,2646
ставить поставить кого что друг против друга,настраивать настроить кого что друг против друга,3094
стрелять выстрелить друг в друга стреляться,стрелять выстрелить в кого,1908
укорачивать укоротить что,сокращение,1695
мазать намазывать намазать что чем на что,чиркать чем,1953
завидовать кому,завидовать друг Другу,1359
добавлять добавить что чего,добавление,1131
подзадоривать подзадорить кого натравливать натравить кого на кого,дразнить кого,2805
подзадоривать подзадорить кого натравливать натравить кого на кого,дразнить кого,2805
класть положить что подо что,хоронить похоронить кого,2764
терять потерять растерять друг друга потеряться,ссориться поссориться,1350
терять потерять растерять друг друга потеряться,ссориться поссориться,1350
перечислять перечислить называть назвать упомянуть всех,перечисление упоминание,1228
базарные плата взимаемая официальным лицом с частных торговцев на рынке,рыночная цена,735
протекать течь между чем в направлении от говорящего,проскакивать проскочить между кем чем в направлении от говорящего,2360
крокодил,дракон,986
крокодил,драконий,377
коса косы,грива,340
пуп пупок,почка растения,391
запоминать запомнить что,понимать понять что,1289
страх отчаяние ужас,страшный ужасный,893
вызывающий панику,безнадёжный,54
думать подумать о чём,помнить не забывать кого что чего,1244
поперхнуться,давиться подавиться,1545
крайне неприятный противный отвратительный,невкусный безвкусный,478
ширь простор,ширина,1003
широко,широко охватывая всё или многих,773
ворчать проявлять проявить недовольство кем чем,ворчание,1242
ворчать проявлять проявить недовольство кем чем,ругань брань,2765
приходить прийти по направлению к говорящему большой группой,трогаться тронуться сдвигаться сдвинуться с места по направлению к говорящему,2328
хлынуть в помещение по направлению к говорящему,проникать проникнуть внутрь по направлению к говорящему о ветре,2355
выползать выползти из помещения по направлению к говорящему,улизнуть из помещения по направлению к говорящему,2403
выбрасывать выбросить кого что из помещения по направлению к говорящему,выталкивать вытолкнуть кого из помещения по направлению к говорящему,2403
приставлять приставить что к чему действуя по направлению к говорящему,ставить поставить кого рядом с кем чем действуя по направлению к говорящему,2354
посыпать посыпать что чем,ссыпать ссыпать что,2451
падать упасть сваливаться свалиться на что,падать упасть в обморок,2164
выходить выйти куда по направлению к говорящему,выходить выйти в круг по направлению к говорящему напр танцевать,1838
выпадать выпасть вываливаться вывалиться из окна щели и,выскакивать выскочить вылетать вылететь о втулке и,2201
выпадать выпасть вываливаться вывалиться из окна щели и,вылезать вылезти высовываться высунуться показываться показаться наружу,2201
оставлять оставить забывать забыть кого что в массе однородных предметов,пускать пустить кого что в густую или однородную массу,2962
вытаскивать вытащить вынимать вынуть что,вынимать вынуть кого что,2113
убавлять убавить уменьшать уменьшить вес отложив часть чего л,ускорять ускорить что,1733
стучать постучать действуя по направлению к говорящему,дуть о ветре по направлению к говорящему,2356
стучать постучать действуя по направлению к говорящему,хлынуть потечь по направлению к говорящему,2356
забираться забраться пробираться пробраться проникать проникнуть куда по направлению к говоря щему,проникать проникнуть просачиваться просочиться куда,2567
забираться забраться пробираться пробраться проникать проникнуть куда по направлению к говоря щему,проникать проникнуть просачиваться просочиться куда,2567
выл и ваться вылиться о густой массе по направлению к говорящему,ползти переливаться через край о густой массе по направлению к говорящему,2378
выходить выйти откуда по направлению к говорящему,приходить прийти приезжать приехать,2357
момент выпуска кого чего,момент броска,712
переходить перейти переезжать переехать через горы и п по направлению к говорящему,сходить сойти,2228
становиться стать мутным замутиться о воде,становиться стать пасмурным портиться испортиться о погоде,1201
опаздывать опоздать на что,отставать отстать,1549
рассказывать рассказать что,выговаривать выговорить произносить произнести что,2334
бодать боднуть кого что,ударять ударить кого что по чему,2722
собирать собрать что,сгребать сгрести что в кучу,1924
перех вырывать вырвать выдёргивать выдернуть что,неперех отрываться оторваться отлетать отлететь,2115
выпадать выпасть о зубах,отваливаться отвалиться отрываться оторваться,2069
становиться стать тёмно серым,становиться стать тёмно коричневым,1194
спутник попутчик,сослуживец сотрудник коллега,865
быть спутником попутчиком,быть сослуживцем сотрудником коллегой,3078
спор тяжба,скандал,48
подводить подвести подвоз ить подвезти кого что к кому чему,знакомить познакомить кого друг с другом,1226
громко,многозначительно,270
уметь суметь склеить что с чем,уметь суметь заставить кого бороться друг с другом,1299
уметь суметь поднести кого что к ко му чему,подносить поднести кого что к кому чему по чьему л желанию по чьей л просьбе,2893
уметь суметь подвести кого что к кому чему,подводить подвести кого что к кому чему по чьему л желанию по чьей л просьбе,2729
уметь суметь привязать кого что друг к другу,привязывать привязать кого что друг к другу по желанию по просьбе,1330
уметь суметь привязать кого что друг к другу,привязывать привязать кого что друг к другу по желанию по просьбе,1330
уметь суметь выгнать кого,уметь суметь распутать раскрыть преступление и,2503
кое как,некоторые кое кто,1227
кое где,кое куда куда нибудь,2935
уметь писать,суметь написать что,1286
уметь работать,работать поработать на кого для кого,2902
глагольный аффикс л ч,глагольный аффикс показатель субъекта л ч напр апионерква г амдара йцат пионеры пошли на экскурсию,1033
в разн карточка,карточки продовольственные,247
ударять ударить,удар,170
переселяться переселиться,переселение,679
погибать погибнуть,гибель,2538
погибать погибнуть,гибель,2538
то что спрятано,клад,209
тесать вытесать что и без доп,строгать выстрогать что и без доп,2124
виновный,несправедливый,691
быть виновным,быть несправедливым,647
скорчившийся,сгорбленный,159
очередь,смена,235
очередь,смена,235
весёлый,бодрый,76
весёлый,бодрый,76
повалить побороть кого,валить повалить что,2848
снимать снять что с чего напр со стены,соскабливать соскоблить что с чего,1951
становиться стать слабым нетугим,становиться стать расслабленным вялым,1155
толчёный и молотый,рушеный и молотый,129
становиться стать слепым слепнуть ослепнуть,становиться стать близоруким недальновидным,1202
слепота,близорукость недальновидность,1008
становиться стать бессмысленным,становиться стать бесполезным,1157
становиться стать бессмысленным,становиться стать бесполезным,1157
счастливый радостный солнечный день,счастье,913
терять потерять сознание,сильно уставать устать,1481
неперех оформлять оформить брак по мусульманскому обряду,регистрировать зарегистрировать брак,819
перех выскальзывать выскользнуть из рук,перех упускать упустить кого что из рук ронять уронить выронить кого что,2119
носить нес номр номер,разносить раз мер дома,1622
инвалидность,дефектность,648
в риторическом обращении при существительном или местоимении напр о сынбджваг в о друг мой о схъаг ара о мой любимый,при риторическом восклицании для усиления эмоциональной выразительности,1874
в риторическом обращении при существительном или местоимении напр о сынбджваг в о друг мой о схъаг ара о мой любимый,для выражения восхи щения удивления сожаления негодования и напр,866
покойник покойница,покойный умерший,699
заезжать заехать въезжать въехать заходить зайти входить войти во двор,идти пойти в бой в атаку,2070
укорачивать укоротить что,сокращение закругление,1695
приближать приблизить что во времени,приближать приблизить к себе кого,1380
запутывать запутать кого что вводить ввести в заблуждение кого,путать перепутать спутать что,2826
уменьшать уменьшить асас дырчара йгьи дырпхара на снижать снизить что,сокращать сокра утеплять утеплить что,2037
удорожать удорожить чти поднимать поднять цепы на что,пе рен прнииматг принять хорошо косо Лбаз русск л,1788
плавить расплавлять расплавить что,топить растапливать растопить напр масло жир,1761
усиливать уси лить что,ускорять ускорить что,2010
ставить поставить что возле около многих,грозить пригрозить оружием многим,2738
разбивать разбить вдребезги что,разрушать разрушить что,1900
разбивать разбить вдребезги что,разрушать разрушить что,1900
шатать расшатывать расшатать что,качать укачивать кого что,1406
становиться стать бдительным,становиться стать осторожным осмотрительным,1177
в разн ряд,строка строчка,944
сафьян,хром кожа в роли опр,951
подсолнух,семечки подсолнуха в роли опр подсолнечный,6
надмогильный камень надгробие,памятник,832
валять свалять что,ткать соткать что,1690
направление действия снизу вверх напр тгара вытаскивать что снизу вверх,направление действия изнутри вверх напр тыпара выпрыгнуть из ямы и,2564
направление действия во внутрь напр так шара бить ударять во что,направление действия сверху вниз напр андакь тапара прыгнуть в канаву,2045
направление действия во внутрь напр так шара бить ударять во что,нахождение пребывание в чём л внутри напр адзы тагылазлара стоять в воде,2048
плевать плюнуть во что,плевать плюнуть сверху вниз,2049
арестовывать арестовать кого,уличать уличить кого в чём,2815
быть запертым где,быть арестованным,3042
быть запертым где,быть арестованным,3042
спускаться спуститься,влезать влезть внутрь чего л,2205
спускаться спуститься,влезать влезть внутрь чего л,2205
перех разбивать разбить что в чём,неперех рушиться обрушиваться обрушиться,1897
нерасторопно неповоротливо,сонливо вяло,519
оставаться остаться сохраняться сохраниться где,оставаться остаться со храняться сохраниться в памяти,2649
нападать напасть на кого,нападение,2197
выбегать выбежать выскакивать выскочить из углубления,ускакать умчаться,2154
выносливый сильный,расторопный ловкий быстрый,272
быть выносливым сильным,быть расторопным ловким быстрым,1564
огораживаться огородиться чем,окружать окружить себя кем чем,2791
рвать на себе напр волосы одежду в припадке отчаяния горя,ругаться браниться,2089
обижаться обидеться,капризничать закапризничать,1537
становиться стать модным,становиться стать кокетливым,1174
задание,работа,689
волосы на голове,коса косы,984
мозг,ум рассудок,570
болтать,надоедать надоесть болтовнёй,565
сдирать содрать что,перех срывать сорвать что,1723
рассыпать рассыпать что л нанизанное на нитку и амхвква хъырп лара рассыпать бусы,рассыпать рассыпать что наполнив верхом,1786
плесневеть заплесневеть,преть сопреть гнить сгнить,1649
поручать поручить что кому,поручение,1657
поручать поручить что кому,обязанность,1118
поручение,обязанность,674
быть бесхарактерным,бесхарактерность,651
есть употреблять в пищу запрещённое религией,проявлять проявить нечестность присваивать присвоить незаконным образом что,1609
здравица заздравный тост,бокал с вином,23
журчать зажурчать,звон,45
перех грабить ограбить кого что,воровство,2853
волдырь,мозоль,348
неперех бодать боднуть кого ачвыгъь ала йацраст бык боднул собаку,неперех бодаться,2090
помощник,заместитель,239
выметать вымести что,сгребать сгрести что в кучу,1724
выметать вымести что,сгребать сгрести что в кучу,1724
перех подкапывать подкопать что,неперех вести подкоп подо что,2004
перех подкапывать подкопать что,неперех вести подкоп подо что,2004
перех подкапывать подкопать что,неперех вести подкоп подо что,2004
чугун чугунок посуда,чугун металл,285
молодость юность,неопытность,881
птенец детёныш квы джьма чыр волчонок,ребёнок,380
становиться стать бесцветным,становиться стать серым невыразительным,1198
становиться стать злым,становиться стать злодеем,1199
становиться стать очень бедным,становиться стать несчастным,1203
скамейка,сиденье,339
звериный,дикий,52
звериный,дикий,52
рассыпаться рассыпаться во рту,сыпаться в рот,1822
рассыпаться рассыпаться во рту,сыпаться в рот,1822
запихивать запихнуть заталкивать затолкнуть засовывать засунуть в рот что,затыкать заткнуть рот не дать пикнуть кому,1809
затуплять затупить что,отбивать отбить кого что у кого отнимать отнять кого что у кого,2941
становиться стать выдержанным,становиться стать тихим скромным,1168
выдержанный,тихий скромный,119
энергичный деятельный,быстрый проворный живой,271
энергичный деятельный,ловкий,603
след,след отпечаток,210
посещать посетить кого что,захаживать заходить зайти заезжать заехать к кому,2942
посещать посетить кого что,приходить прийти приезжать приехать за кем чем,1373
