sense_1,sense_2,main_cl
вызывающий панику,безнадёжный,54
забывать забыть по рассеянности,забывчивость рассеянность,1547
неспокойный беспокойный,трудный сопряжённый с трудностями,492
неспокойный беспокойный,трудный сопряжённый с трудностями,492
плохо себя чувствуя недомогая,неспокойно беспокойно,1504
нападать напасть на кого что йрым дырдзак ва ргвыквсара напасть внезапно неожиданно,заставать застать внезапно врасплох кого в агрессия,2198
мысленно про себя,наизусть,564
поперхнуться,давиться подавиться,1545
дума,горе переживание,564
сердечное заболевание,сострадание сочувствие,607
сердечное заболевание,сострадание сочувствие,607
воодушевляться воодушевиться,смелеть осмелеть,1479
воодушевляться воодушевиться,воодушевление,1667
широкий,толстый полный о человеке,152
чужестранец,скитальческий,72
певец импровизатор,шутник весельчак,843
выпадать выпасть,располагать временем иметь свободное время,1505
выглядывать виднеться из чего будучи обращённым в сторону говорящего,смотреть посмотреть через щель по направлению к говорящему,1871
нападать напасть на кого по направлению к говорящему,неожиданно заставать застать кого где,2368
нападать напасть на кого по направлению к говорящему,неожиданно заставать застать кого где,2368
собирать собрать кого в дорогу,собирать собрать на стол накрывать накрыть стол,1758
растить вырастить поставить на ноги кого,выхаживать выходить кого,2751
растить вырастить поставить на ноги кого,выхаживать выходить кого,2751
созывать созвать кого что,скликать кого,1234
надписывать надписать что,накладывать наложить резолюцию,1137
выходить выйти куда по направлению к говорящему,выходить выйти в круг по направлению к говорящему напр танцевать,1838
отламывать отломить отбивать отбить что от чего,откалывать отколоть что от чего,1929
отрываться оторваться облетать отлететь,обиваться обиться отваливаться отвалиться о штукатурке,2187
выглядывать выглянуть,виднеться просвечивать,1552
гром переносить перенести что на другую строку,распространять распространить что вести слухи и,1853
оставлять оставить забывать забыть кого что в массе однородных предметов,включать включить вводить ввести кого куда,2959
класть положить что куда во что,прикалывать приколоть что к чему,2911
выглядывать выглянуть из леса зарослей и п по направлению к говорящему,виднеться просвечивать сквозь что,1113
выходить выйти из леса зарослей и п по направлению к говорящему,отделяться отделиться от кого,2371
выпускать выпустить кого из леса зарослей и п по направлению к говорящему,прокалывать проколоть что адзадз аджьунт йг алщтра шилом проколоть картонку,2453
выскальзывать выскользнуть из свёртка и по направлению к говорящему аш ах ва акнига г амгвыг взт из свёртка выскользнула книга,выползать выползти из под чего по направлению к говорящему,2375
опускаться опуститься снижаться снизиться,склониться склониться сникать сникнуть о ветвях дерева листьях кукурузы и,2477
выбивать выбить ударом из рук что,выманивать выманить что у кого выуживать выудить что у кого,2099
сгружать сгрузить что в сторону говорящего,убирать убрать брать взять кого что,3016
отцеплять отцепить что действуя по направлению к говорящему,перерезать перерезать что мгновенно,2376
освобождать освободить кого что от неприятеля,освобождать освободить выпускать выпустить на волю кого предоставлять предоставить свободу кому,2967
убавлять убавить уменьшать уменьшить вес отложив часть чего л,ускорять ускорить что,1733
стучать постучать действуя по направлению к говорящему,перех жалить ужалить кого,2076
подавать подать что по направлению к говорящему,выбрасывать выбросить кого что из чего откуда Натрышвтра перех,1868
подавать подать что по направлению к говорящему,выбрасывать выбросить кого что из чего откуда Натрышвтра перех,1868
оставлять оставить во дворе кого что,выходить выйти замуж раньше старшей сестры,2960
вкатывать вкатить во двор что,загонять загнать во двор кого что,2262
подниматься подняться наверх по направлению к говорящему,лезть налезать налезть об обуви о головном уборе,1855
досыпать досыпать что чего,пришивать пришить что к чему Нахъаптштшра перех сильно стучать барабанить во что беи ствие направлено к говорящему,2433
досыпать досыпать что чего,пришивать пришить что к чему Нахъаптштшра перех сильно стучать барабанить во что беи ствие направлено к говорящему,2433
вытаскивать вытащить из очага к себе положенное ранее,вытаскивать вытащить к себе положенное ранее в золу,2183
перех вырывать вырвать выдёргивать выдернуть что,перех корчевать выкорчевать что,1813
время выхода из под чего,время восхода небесных светил,2571
выпадать выпасть о зубах,отваливаться отвалиться отрываться оторваться,2069
осыпаться осыпаться о зёрнах подсолнуха кукурузы и,падать о фруктах,1430
повадиться куда,привыкать привыкнуть к кому чему,2961
истец,скандалист,139
удача успех,достижение,884
диагональный,диагоналевый,1005
человек строго соблюдающий предписания религии веры,служитель культа,823
отправлять отправить кого что в направлении от говорящего,запускать запустить что,2995
отправлять отправить кого что в направлении от говорящего,запускать запустить что,2995
в разн густой хък ы жвп а густая сметана,толстый о стёганых вязаных и вещах о плоских предметах,1745
уметь суметь склеить что с чем,уметь суметь заставить кого бороться друг с другом,1299
уметь суметь подогнать кого что к чему,подгонять подогнать кого что к кому чему для кого,2893
уметь суметь отогнать кого от чего,отгонять отогнать кого от чего по чьему л желанию по чьей л просьбе,3008
уметь суметь воевать,уметь суметь драться,1445
насилие произвол,деспотичный,171
уметь суметь читать,читать для кого,1279
уметь суметь выгнать кого,выгонять выгнать кого по чьей л просьбе,2666
суметь избить исколотить одолеть кого в драке, уметь молотить,1911
уметь суметь остричь кого,стричь постричь остричь кого по чьей л просьбе,2889
уметь суметь успокоить кого,успокаивать успокоить кого по чьей либо просьбе,2730
уметь суметь успокоить кого,успокаивать успокоить кого по чьей либо просьбе,2730
уметь суметь накормить кого,кормить на кормить кого по чьей л просьбе,2891
уметь суметь накормить кого,кормить на кормить кого по чьей л просьбе,2891
то находится лежит на виде транспорта,то напечатано где,3047
вообще,именно как раз,683
то висит,то лежит,715
виновный,несправедливый,691
быть виновным,быть несправедливым,647
корневище часть корня,усики у растений,758
ветвистый разветвленный,лохматый,400
ветвистый разветвленный,лохматый,400
выходить выйти из среды,отделываться отделаться отвязываться отвязаться от кого,2650
быть широким,быть плоским ровным,446
голый нагой,босой,427
весёлый,пьяный хмельной,36
весёлость веселье,бодрость,3
весёлость веселье,бодрость,3
валить повалить кого,валить повалить что,1990
топтать вытоптать травить потравить посевы и,бить побить избивать избить кого,2100
возвышающийся над чем,остроконечный,493
север,направление в сторону нижерасположенной местности,737
север,склон спуск,1001
сказочник сказочница,шутник шутница балагур,1075
рабство,крепостничество,626
счастливый радостный солнечный день,счастье,913
счастливый радостный солнечный день,счастье,913
непрочность,слабость недомогание,497
непрочность,слабость недомогание,497
становиться стать непрочным,слабеть ослабеть хиреть захиреть,1211
терять потерять сознание,потеря сознания,925
терять потерять сознание,потеря сознания,925
крупный большой рослый,кряжистый,118
ожог,пожар пожарище,180
маломощный малосильный,бедный,103
маломощный малосильный,бедный,103
несчастный,гадкий о человеке,927
достигать достичь чего доходить дойти доезжать доехать доплывать доплыть долетать долететь до чего,равняться быть равным чему,2563
убывать убыть,снижаться снизиться,1496
сжимать сжать в руках что,не давать воли кому держать в ежовых рукавицах кого,2741
перех брать взять кого что,перех принимать принять кого в организацию компанию группу,3015
перех брать взять кого что,перех принимать принять кого в организацию компанию группу,3015
инвалидность,дефектность,648
талия,перен остов каркас костя к,421
покойник покойница,труп,919
долина,район,724
дешеветь подешеветь,терять потерять честь,1523
неженатый холостой,холостяцкий,67
перех ломать поломать сломать что,п е р ел о м напр кости,1941
быть в разведке ходить в разведку,наблюдать вести наблюдение,1250
разведчик,наблюдающий за местностью дозорный,184
губа губы, носок (обуви)} чрыкъв пыкв носок сапога,409
воодушевлять воодушевить кого,подбадривать подбодрить кого,2667
колодка сапожная,шесты служащие для растяжки шкур животных при высушивании,1751
квасить заквашивать заквасить что,обрабатывать обработать кустарным способом кожу,1814
ставить поставить что возле около многих,грозить пригрозить оружием многим,2738
ставить поставить что возле около многих,грозить пригрозить оружием многим,2738
облегчать облегчить что делать сделать лёгким что в весе,ускорять ускорить что,1535
прореживать проредить что,делать сделать жидким разжижать разжичить что,1975
стрела,вид старинного одноствольного ружья,1066
бдительный,бережный,168
бдительный,бережный,168
бдительно,осторожно осмотрительно,611
бдительно,бережно осторожно,611
гостиница,ночлежка ночлежный дом,332
спускаться спуститься,влезать влезть внутрь чего л,2205
прогибать прогнуть что,прогибать прогнуть находясь в или на чем л,2092
ссылать сослать высылать выслать кого,выносить вынести вывозить вывезти кого что,1762
выступ,горб,186
лакать вылакать что,проглотить съесть в мгновение ока что,2131
жалобщик,постоянно жалующийся хныкающий,608
основание подошва,лощина,176
мохнатые щётки над копытами чаще у лошадей,кустящееся растение имеющее множество побегов от корня,1886
сплачиваться сплотиться объединяться объединиться,сплочённость,3069
погибать погибнуть по своей неосторожности,утомлять утомить изнурять изнурить себя чем,2068
долго не выходить замуж засидеться в девушках,долго не жениться,3059
долго не выходить замуж засидеться в девушках,оставаться остаться надолго пробыть долго в чь ем л дво ре,3059
выходить выйти со двора выезжать выехать со двора,уходить уйти из Дому,2700
развязно держаться невоспитанно вести себя,балагурить,1628
наедаться наесться досыта,наживаться нажиться на чём,1629
шевелиться пошевелиться,качаться раскачиваться раскачаться,1526
сворачиваться свернуться кольцами напр о змее,виться о волосах об усиках растений,1789
сдерживаться сдержаться удерживаться удержаться от чего,успокаиваться успокоиться,1506
сдерживаться сдержаться удерживаться удержаться от чего,успокаиваться успокоиться,1506
доставлять доставить себе удовольствие радость,притворяться притвориться весёлым бодрым напускать напустить на себя весёлый вид,1538
излишне скромничать,стараться выглядеть скромной как невеста,1586
не обременять себя,утихомириваться утихомириться,1498
казаться миловидным симпатичным,стараться вызвать симпатию,873
топиться утопиться,перен давиться подавиться,1469
терпеть переносить перенести что,терпение,1480
терпеть переносить перенести что,терпение,1480
становиться стать тучным полным жиреть разжиреть,поспевать поспеть созревать созреть о фруктах,1206
недобрый злой,озорной баловной шаловливый,503
притворщик притворщица притвора,притворный,785
притворщик притворщица притвора,притворный,785
круглоголовый,тупоносый с затупленным носом,1747
поднимать поднять что, круглоголовый,1737
самолюбие,своеволие,140
забывчивый,пе реп легкомысленный ветреный,187
забывчивый,пе реп легкомысленный ветреный,187
застревать застрять на поверхности чего л,повисать повиснуть на колу дереве и,2472
тащить волочить наверх что,зачёсывать зачесать вверх волосы,1785
подходить подойти по размеру к голове,попадать попасть кольцом кругом на шест кол и,2479
переносить перенести перевозить перевезти что через что,избавлять избавить кого от неприятного,2996
сдирать содрать что,неперех заниматься заняться сдиранием чего,1976
чехлить зачехлить что,надевать надеть напр коронку на зуб,1773
падать с гол овы о головном уборе,срываться сорваться,2102
перебегать перебежать что через что,переливаться перелиться через край бежать убежать о жидкости,2288
обсыхать обсохнуть сверху,обветриваться обветриться о лице губах,1598
переводить перевести в следующий класс и ап хьаг в дахъыщтра перевести ученика в следующий класс,пропускать пропустить кого что давать дать пройти кому через перевал и,2320
ставить поставить на огонь что и без доп,готовить приготовить обед и без доп,1612
доля часть,часть книги романа и ххъвык та йалу книга книга в трех частях,759
суматоха,неприятность дрязги,457
задача,цель,681
журчать зажурчать,звенеть зазвенеть,1700
идти пойти,делать сделать ход б игре пеш кала цара сделать ход пешкой,2317
обозначает нахождение под под внизу,внизу,706
косить скосить глаза,выпячивать выпятить живот,1587
косить скосить глаза,кривить скривить обувь,1599
молодость юность,неопытность,881
притворяющийся плачущим,плач во сне,1687
притворяющийся плачущим,плач во сне,1687
жестокий,злодейский,158
обдирать ободрать что,общипывать общипать кого что,1272
засов,затычка пробка а бочке,302
скоро быстро,громко,563
стоять на склоне горы на ветвях дерева и,держать во рту что тутын йш агыламк ва зынгьи дгьубушым без папиросы во рту его трудно себе представить,2469
затыкать заткнуть рот не дать и пикнуть кому,доносить донести на кого,2774
расстояние,местность,725
сильно скучать соскучиться о ком чём по кому чему,сильно любить полюбить кого,1254
восстанавливать восстановить что,вновь налаживать наладить что,2597
мохнатые щётки над копытами у животных,кустящееся растение имеющее множество побегов от корня,1886
корень растения зуба волоса и ац ла злаща квгылу щатап аг вы дызлаща квгылу фачКвып поел дерево держится своими корнями а человек пищей,корень,1025
кровоподтёк,кровотечение,58
стремя стремена,штрипка,218
посещать посетить кого что,захаживать заходить зайти заезжать заехать к кому,2942
отправлять отправить кого что вслед за кем чем,пускать пустить кого вдогонку за кем чем,2968
трудиться в поте лица над чем,уставать устать выполняя работу,1127
вновь вступать вступить куда, вновь слиться (объединиться),2595
неубранный о помещении,несобранный неаккуратный,516
толочь что чем, толочь что вместе счем (напр. чеснок с солью),2032
мазать что чем,вмазывать вмазать что во что,2031
выезжать выехать выходить выйти в направлении от говорящего,выводиться о пятнах,2703
налезать налезть быть впору об обуви о головных уборах,входить войти помещаться поместиться,2480
похожий,одинаковый,1037
быть похожим,быть равным,3072
хлынуть в помещение по направлению к говорящему,проникать проникнуть внутрь по направлению к говорящему о ветре,2355
